{
  "$schema": "https://auralislab.dev/schema/palette-v1.json",
  "schemaVersion": 1,
  "packageVersion": "0.10.1",
  "themes": {
    "Syntalume Noir": {
      "file": "themes/noir-color-theme.json",
      "type": "dark",
      "editorBackground": "#0f1117",
      "editorForeground": "#e9e4dc",
      "accent": "#ff955085",
      "terminal": {
        "terminal.background": "#0a0c11",
        "terminal.foreground": "#e9e4dc",
        "terminal.ansiBlack": "#0f1117",
        "terminal.ansiBrightBlack": "#63666d",
        "terminal.ansiRed": "#fc5855",
        "terminal.ansiBrightRed": "#ff625f",
        "terminal.ansiGreen": "#6ec272",
        "terminal.ansiBrightGreen": "#75d87a",
        "terminal.ansiYellow": "#e9ab2b",
        "terminal.ansiBrightYellow": "#ffbc19",
        "terminal.ansiBlue": "#25d2fc",
        "terminal.ansiBrightBlue": "#00e8ff",
        "terminal.ansiMagenta": "#e175d9",
        "terminal.ansiBrightMagenta": "#fc82f3",
        "terminal.ansiCyan": "#52dfbf",
        "terminal.ansiBrightCyan": "#47f7d2",
        "terminal.ansiWhite": "#e9e4dc",
        "terminal.ansiBrightWhite": "#f6f1e9"
      }
    },
    "Syntalume Frost": {
      "file": "themes/frost-color-theme.json",
      "type": "dark",
      "editorBackground": "#060e14",
      "editorForeground": "#ddeff5",
      "accent": "#00d7e485",
      "terminal": {
        "terminal.background": "#02080e",
        "terminal.foreground": "#ddeff5",
        "terminal.ansiBlack": "#060e14",
        "terminal.ansiBrightBlack": "#5b6c74",
        "terminal.ansiRed": "#ff5169",
        "terminal.ansiBrightRed": "#ff5b75",
        "terminal.ansiGreen": "#00d097",
        "terminal.ansiBrightGreen": "#00e7a7",
        "terminal.ansiYellow": "#e6b816",
        "terminal.ansiBrightYellow": "#ffca00",
        "terminal.ansiBlue": "#00e5f2",
        "terminal.ansiBrightBlue": "#00fcff",
        "terminal.ansiMagenta": "#a688ff",
        "terminal.ansiBrightMagenta": "#b997ff",
        "terminal.ansiCyan": "#48e8c5",
        "terminal.ansiBrightCyan": "#38ffd8",
        "terminal.ansiWhite": "#ddeff5",
        "terminal.ansiBrightWhite": "#ebfcff"
      }
    },
    "Syntalume Paper": {
      "file": "themes/paper-color-theme.json",
      "type": "light",
      "editorBackground": "#faf4ec",
      "editorForeground": "#352c25",
      "accent": "#d45b3d85",
      "terminal": {
        "terminal.background": "#ede7de",
        "terminal.foreground": "#352c25",
        "terminal.ansiBlack": "#282019",
        "terminal.ansiBrightBlack": "#80756d",
        "terminal.ansiRed": "#cc272e",
        "terminal.ansiBrightRed": "#be000c",
        "terminal.ansiGreen": "#308639",
        "terminal.ansiBrightGreen": "#007617",
        "terminal.ansiYellow": "#bb6a00",
        "terminal.ansiBrightYellow": "#ad5300",
        "terminal.ansiBlue": "#044cb6",
        "terminal.ansiBrightBlue": "#0035ad",
        "terminal.ansiMagenta": "#6365c1",
        "terminal.ansiBrightMagenta": "#524fb8",
        "terminal.ansiCyan": "#007982",
        "terminal.ansiBrightCyan": "#006975",
        "terminal.ansiWhite": "#352c25",
        "terminal.ansiBrightWhite": "#2b221b"
      }
    },
    "Syntalume Botanica": {
      "file": "themes/botanica-color-theme.json",
      "type": "dark",
      "editorBackground": "#0e1913",
      "editorForeground": "#e5e6d7",
      "accent": "#95cb5485",
      "terminal": {
        "terminal.background": "#08130d",
        "terminal.foreground": "#e5e6d7",
        "terminal.ansiBlack": "#0e1913",
        "terminal.ansiBrightBlack": "#616c63",
        "terminal.ansiRed": "#fc5855",
        "terminal.ansiBrightRed": "#ff625f",
        "terminal.ansiGreen": "#68cb6e",
        "terminal.ansiBrightGreen": "#6fe276",
        "terminal.ansiYellow": "#e6ac3d",
        "terminal.ansiBrightYellow": "#ffbd34",
        "terminal.ansiBlue": "#a1d862",
        "terminal.ansiBrightBlue": "#b0ee65",
        "terminal.ansiMagenta": "#e29936",
        "terminal.ansiBrightMagenta": "#fea92f",
        "terminal.ansiCyan": "#68e4c6",
        "terminal.ansiBrightCyan": "#62fcd9",
        "terminal.ansiWhite": "#e5e6d7",
        "terminal.ansiBrightWhite": "#f2f3e4"
      }
    },
    "Syntalume Noir High Contrast": {
      "file": "themes/noir-contrast-color-theme.json",
      "type": "dark",
      "editorBackground": "#040508",
      "editorForeground": "#faf6ef",
      "accent": "#ff9550",
      "terminal": {
        "terminal.background": "#020305",
        "terminal.foreground": "#faf6ef",
        "terminal.ansiBlack": "#040508",
        "terminal.ansiBrightBlack": "#8e929e",
        "terminal.ansiRed": "#fc5855",
        "terminal.ansiBrightRed": "#ff625f",
        "terminal.ansiGreen": "#6ec272",
        "terminal.ansiBrightGreen": "#75d87a",
        "terminal.ansiYellow": "#e9ab2b",
        "terminal.ansiBrightYellow": "#ffbc19",
        "terminal.ansiBlue": "#25d2fc",
        "terminal.ansiBrightBlue": "#00e8ff",
        "terminal.ansiMagenta": "#e175d9",
        "terminal.ansiBrightMagenta": "#fc82f3",
        "terminal.ansiCyan": "#52dfbf",
        "terminal.ansiBrightCyan": "#47f7d2",
        "terminal.ansiWhite": "#faf6ef",
        "terminal.ansiBrightWhite": "#fcf8f1"
      }
    },
    "Syntalume Frost Colorblind": {
      "file": "themes/frost-colorblind-color-theme.json",
      "type": "dark",
      "editorBackground": "#060e14",
      "editorForeground": "#ddeff5",
      "accent": "#00d8f685",
      "terminal": {
        "terminal.background": "#02080e",
        "terminal.foreground": "#ddeff5",
        "terminal.ansiBlack": "#060e14",
        "terminal.ansiBrightBlack": "#5b6c74",
        "terminal.ansiRed": "#fc984c",
        "terminal.ansiBrightRed": "#ffa64c",
        "terminal.ansiGreen": "#00cef3",
        "terminal.ansiBrightGreen": "#00e5ff",
        "terminal.ansiYellow": "#e6b816",
        "terminal.ansiBrightYellow": "#ffca00",
        "terminal.ansiBlue": "#00e2ff",
        "terminal.ansiBrightBlue": "#00f9ff",
        "terminal.ansiMagenta": "#ed9e2f",
        "terminal.ansiBrightMagenta": "#ffae23",
        "terminal.ansiCyan": "#60e7d8",
        "terminal.ansiBrightCyan": "#55ffed",
        "terminal.ansiWhite": "#ddeff5",
        "terminal.ansiBrightWhite": "#ebfcff"
      }
    },
    "Syntalume Paper High Contrast": {
      "file": "themes/paper-contrast-color-theme.json",
      "type": "light",
      "editorBackground": "#fffcf8",
      "editorForeground": "#1f1610",
      "accent": "#d45b3d",
      "terminal": {
        "terminal.background": "#f3ede5",
        "terminal.foreground": "#1f1610",
        "terminal.ansiBlack": "#130b06",
        "terminal.ansiBrightBlack": "#5a5049",
        "terminal.ansiRed": "#cc272e",
        "terminal.ansiBrightRed": "#be000c",
        "terminal.ansiGreen": "#308639",
        "terminal.ansiBrightGreen": "#007617",
        "terminal.ansiYellow": "#bb6a00",
        "terminal.ansiBrightYellow": "#ad5300",
        "terminal.ansiBlue": "#044cb6",
        "terminal.ansiBrightBlue": "#0035ad",
        "terminal.ansiMagenta": "#6365c1",
        "terminal.ansiBrightMagenta": "#524fb8",
        "terminal.ansiCyan": "#007982",
        "terminal.ansiBrightCyan": "#006975",
        "terminal.ansiWhite": "#1f1610",
        "terminal.ansiBrightWhite": "#150e08"
      }
    },
    "Syntalume Dimmed": {
      "file": "themes/dimmed-color-theme.json",
      "type": "dark",
      "editorBackground": "#080a0d",
      "editorForeground": "#d4d0ca",
      "accent": "#ca933e85",
      "terminal": {
        "terminal.background": "#040608",
        "terminal.foreground": "#d4d0ca",
        "terminal.ansiBlack": "#080a0d",
        "terminal.ansiBrightBlack": "#5b6167",
        "terminal.ansiRed": "#fc5855",
        "terminal.ansiBrightRed": "#ff625f",
        "terminal.ansiGreen": "#6ec272",
        "terminal.ansiBrightGreen": "#75d87a",
        "terminal.ansiYellow": "#e9ab2b",
        "terminal.ansiBrightYellow": "#ffbc19",
        "terminal.ansiBlue": "#41bdd1",
        "terminal.ansiBrightBlue": "#2fd4ec",
        "terminal.ansiMagenta": "#19a9b0",
        "terminal.ansiBrightMagenta": "#00bfc8",
        "terminal.ansiCyan": "#6fc4ae",
        "terminal.ansiBrightCyan": "#6ddcc0",
        "terminal.ansiWhite": "#d4d0ca",
        "terminal.ansiBrightWhite": "#e1ddd7"
      }
    },
    "Syntalume Void": {
      "file": "themes/void-color-theme.json",
      "type": "dark",
      "editorBackground": "#000000",
      "editorForeground": "#e1ded5",
      "accent": "#00d9fa85",
      "terminal": {
        "terminal.background": "#000000",
        "terminal.foreground": "#e1ded5",
        "terminal.ansiBlack": "#000000",
        "terminal.ansiBrightBlack": "#696870",
        "terminal.ansiRed": "#fc5855",
        "terminal.ansiBrightRed": "#ff625f",
        "terminal.ansiGreen": "#61cb7c",
        "terminal.ansiBrightGreen": "#65e287",
        "terminal.ansiYellow": "#e6b22d",
        "terminal.ansiBrightYellow": "#ffc31a",
        "terminal.ansiBlue": "#00dffd",
        "terminal.ansiBrightBlue": "#00f6ff",
        "terminal.ansiMagenta": "#c787ff",
        "terminal.ansiBrightMagenta": "#de95ff",
        "terminal.ansiCyan": "#5ae6c6",
        "terminal.ansiBrightCyan": "#50fed8",
        "terminal.ansiWhite": "#e1ded5",
        "terminal.ansiBrightWhite": "#eeebe2"
      }
    }
  },
  "aliases": {
    "Auralis Noir": "Syntalume Noir",
    "Auralis Frost": "Syntalume Frost",
    "Auralis Paper": "Syntalume Paper",
    "Auralis Botanica": "Syntalume Botanica",
    "Auralis Noir High Contrast": "Syntalume Noir High Contrast",
    "Auralis Frost Colorblind": "Syntalume Frost Colorblind",
    "Auralis Paper High Contrast": "Syntalume Paper High Contrast",
    "Auralis Dimmed": "Syntalume Dimmed",
    "Auralis Void": "Syntalume Void"
  },
  "iconAssociations": {
    "file": "icon-associations.json",
    "definitions": 398,
    "fileExtensions": 227,
    "fileNames": 312,
    "folderNames": 122,
    "rootFolderNames": 0,